<?xml version="1.0" encoding="utf-8"?>
<Members>
  <!--xmlns:xsi="http://www.w3.org/2001/XMLSchema-instance" xsi:noNamespaceSchemaLocation="MemberSchema.xsd">-->
  <Member>
    <user_name>Test</user_name>
    <password>check</password>
  </Member>
  <Member>
    <user_name>Test2</user_name>
    <password>check2</password>
  </Member>
  <Member>
    <user_name>TanTest</user_name>
    <password>VXiXcyCjf2vJkG/0B33XuA==</password>
  </Member>
  <Member>
    <user_name>TanTest2</user_name>
    <password>VXiXcyCjf2vJkG/0B33XuA==</password>
  </Member>
  <Member>
    <user_name>TanTest3</user_name>
    <password>VXiXcyCjf2vJkG/0B33XuA==</password>
  </Member>
</Members>